<?xml version="1.0"?>
<!DOCTYPE Report
[
<!ELEMENT Report (General ,(Doc|BPT)) >
<!ATTLIST Report ver CDATA #REQUIRED tmZone CDATA #REQUIRED>

<!ELEMENT General ( DocLocation ) >
<!ATTLIST General productName CDATA #REQUIRED productVer CDATA #REQUIRED os CDATA #REQUIRED host CDATA #REQUIRED qcserver CDATA #IMPLIED qcproject CDATA #IMPLIED SolManSolutionId CDATA #IMPLIED SolManProjectId CDATA #IMPLIED SolManTestPlanId CDATA #IMPLIED SolManTestPackageId CDATA #IMPLIED SolManUserInfoData CDATA #IMPLIED  >

<!ELEMENT BPT (DName,Res,DVer?,TSet?,TInst?,NodeArgs,AdditionalInfo*,Doc*) >
<!ATTLIST BPT rID ID #REQUIRED >

<!ELEMENT Doc (DName,ConfName?,Res,DVer?,TSet?,TInst?,RunType?,DT?,AdditionalInfo*,Step*,DIter*,Step*,Action*,Doc*,Summary?,TestMaintenanceSummary*,NodeArgs?) >
<!ATTLIST Doc rID ID #REQUIRED type (Test|BC|BPTWrapperTest|Flow|Group|Action) "Test" productName CDATA #REQUIRED BCIter CDATA #IMPLIED >

<!ELEMENT RunType ( #PCDATA )>
<!ATTLIST RunType fmStep (False|True) "False" batch (False|True) "False" upDesc (False|True) "False" upChk (False|True) "False" upAS (False|True) "False">

<!ELEMENT DName ( #PCDATA ) >

<!ELEMENT ConfName ( #PCDATA ) >

<!ELEMENT Res ( #PCDATA ) >

<!ELEMENT AdditionalInfo (AdditionalDataName,AdditionalDataValue ) >

<!ELEMENT AdditionalDataName ( #PCDATA ) >

<!ELEMENT AdditionalDataValue ( #PCDATA ) >

<!ELEMENT DVer ( #PCDATA ) >

<!ELEMENT TSet ( #PCDATA ) >

<!ELEMENT TInst ( #PCDATA ) >

<!ELEMENT DIter (Step*,Action+,Summary?,NodeArgs)>
<!ATTLIST DIter rID ID #REQUIRED iterID CDATA #REQUIRED>

<!ELEMENT DocLocation ( #PCDATA )>

<!ELEMENT Action (AName,AIter*,(Step|HtmlStep|Action)*, Summary,ActionMaintenanceSummary*, NodeArgs ) >
<!ATTLIST Action rID ID #REQUIRED>

<!ELEMENT AIter ((Step|HtmlStep|Action)*,DataMapping?, Summary?,NodeArgs) >
<!ATTLIST AIter rID ID #REQUIRED iterID CDATA #REQUIRED isCountable (False|True) "False" >

<!ELEMENT AName ( #PCDATA ) >

<!ELEMENT TestMaintenanceSummary (ActionMaintenanceSummary*) >
<!ATTLIST TestMaintenanceSummary ObjectsAdded CDATA #REQUIRED ObjectsUpdated CDATA #REQUIRED StepsUpdated CDATA #REQUIRED StepsComments CDATA #REQUIRED><!ELEMENT ActionMaintenanceSummary (ObjectChange* ) >
<!ATTLIST ActionMaintenanceSummary Action CDATA #REQUIRED Objects CDATA #REQUIRED Updated CDATA #REQUIRED LinesTotal CDATA #REQUIRED Added CDATA #REQUIRED LinesUpdated CDATA #REQUIRED>

<!ELEMENT ObjectChange  (Hierarchy, PropertyChangeList* ) >
<!ATTLIST ObjectChange Operation CDATA #IMPLIED OriginalRepository CDATA #IMPLIED>

<!ELEMENT PropertyChangeList (PropertyDef*) >

<!ELEMENT PropertyDef (OriginalValue, NewValue) >
<!ATTLIST PropertyDef PropName CDATA #REQUIRED OriginRegularExpression (True|False) "False" NewRegularExpression (True|False) "False" AddedProperty (True|False) "False" >

<!ELEMENT OriginalValue ( #PCDATA )>

<!ELEMENT NewValue ( #PCDATA )>

<!ELEMENT Hierarchy  (ObjectName, Hierarchy*) >
<!ATTLIST Hierarchy MicClass CDATA #REQUIRED>

<!ELEMENT ObjectName  ( #PCDATA ) >

<!ELEMENT Step (Obj,Details,Time,TimeTick* ,(Step|HtmlStep|Doc)*, DataMapping?, NodeArgs) >
<!ATTLIST Step rID ID #REQUIRED retval CDATA #IMPLIED>

<!ELEMENT HtmlStep (HTML,TimeTick*,(Step|HtmlStep|Doc)*,NodeArgs) >
<!ATTLIST HtmlStep rID ID #REQUIRED >

<!ELEMENT Obj ( #PCDATA ) >
<!ATTLIST Obj plainTxt (False|True) "True">

<!ELEMENT Details ( #PCDATA ) >
<!ATTLIST Details plainTxt (False|True) "True">

<!ELEMENT Time ( #PCDATA ) >

<!ELEMENT HTML ( #PCDATA ) >

<!ELEMENT Disp ( #PCDATA ) >

<!ELEMENT TimeTick ( #PCDATA ) >

<!ELEMENT DataMapping ( DataMappedItem* )>
<!ELEMENT DataMappedItem EMPTY >
<!ATTLIST DataMappedItem dsName CDATA #REQUIRED >
<!ATTLIST DataMappedItem rowId CDATA #REQUIRED >

<!ELEMENT NodeArgs (Disp,TopPane?,BtmPane?,ExtendedInfo? )>
<!ATTLIST NodeArgs eType CDATA #REQUIRED icon CDATA #REQUIRED nRep CDATA #REQUIRED UserNote CDATA #IMPLIED filter (False|True) "True">
<!ATTLIST NodeArgs status (Passed|Failed|Done|Warning|Information) "Done">
<!ATTLIST NodeArgs iconSel CDATA #IMPLIED nType CDATA #IMPLIED MovieMarker CDATA "">
<!ATTLIST NodeArgs Source CDATA #IMPLIED SourceLine CDATA #IMPLIED StepFlowItemKey CDATA #IMPLIED >

<!ELEMENT TopPane (Path)>

<!ELEMENT BtmPane ( (Path|WR)?,ASHilite?)>
<!ATTLIST BtmPane vType CDATA "HTML">

<!ELEMENT Path ( #PCDATA ) >

<!ELEMENT ASHilite ( #PCDATA ) >

<!ELEMENT WR ( #PCDATA ) >

<!ELEMENT ExtendedInfo ( StepData ) >

<!ATTLIST ExtendedInfo StepType CDATA #REQUIRED>
<!ELEMENT DT (NodeArgs) >
<!ATTLIST DT rID ID #REQUIRED>

<!ELEMENT Summary (Param*)>
<!ATTLIST Summary sTime CDATA #IMPLIED eTime CDATA #IMPLIED passed CDATA #IMPLIED failed CDATA #IMPLIED warnings CDATA #IMPLIED retval CDATA #IMPLIED stopped (False|True) "False" >

<!ELEMENT Param (ParamName,ParamVal)+ >
<!ATTLIST Param paramInOut (In|Out) "In">

<!ELEMENT ParamName ( #PCDATA ) >

<!ELEMENT ParamVal ( #PCDATA ) >

]
>
<Report ver="2.0" tmZone="W. Europe Standard Time">
<General productName="HPE Unified Functional Testing" productVer="14.0" os="Windows 7" host="NLVHPRAAB01947"><DocLocation><![CDATA[D:\LogFiles\ATAF\ATAF\Functions_Automation\Qmetry Project\ATAF Driver\GUITest1]]></DocLocation></General>
<Doc rID="T1"   productName= "HPE Unified Functional Testing"  >
<DName><![CDATA[GUITest1]]></DName>
<Res><![CDATA[Res5]]></Res>
<DT rID="T2">
<NodeArgs eType="Table" icon="2" nRep="4" filter="False" >
<Disp><![CDATA[Run-Time Data Table]]></Disp>
<BtmPane vType="Table" >
<Path><![CDATA[Default.xls]]></Path>
</BtmPane>
</NodeArgs>
</DT>
<DIter rID="T3" iterID="1" >
<Action rID="T4">
<AName><![CDATA[Action1]]></AName>
<Step rID="T5">
<Obj plainTxt="False" ><![CDATA[SystemUtil]]></Obj>
<Details plainTxt="False" ><![CDATA[SystemUtil]]></Details>
<Time><![CDATA[8/30/2018 - 14:00:06]]></Time>
<TimeTick>1535630406</TimeTick>
<Step rID="T6">
<Obj plainTxt="False" ><![CDATA[Run "C:\Program Files (x86)\Google\Chrome\Application\chrome.exe",1]]></Obj>
<Details plainTxt="False" ><![CDATA[Run "C:\Program Files (x86)\Google\Chrome\Application\chrome.exe",1]]></Details>
<Time><![CDATA[8/30/2018 - 14:00:06]]></Time>
<TimeTick>1535630406</TimeTick>
<NodeArgs eType="Replay" icon="5" nRep="11" status="Passed" Source="Action1" SourceLine="3" >
<Disp><![CDATA[Run "C:\Program Files (x86)\Google\Chrome\Application\chrome.exe",1]]></Disp>
</NodeArgs>
</Step>
<NodeArgs eType="Replay" icon="5" nRep="10" status="Passed" Source="Action1" SourceLine="3" >
<Disp><![CDATA[SystemUtil]]></Disp>
</NodeArgs>
</Step>
<Step rID="T7">
<Obj plainTxt="False" ><![CDATA[Browser]]></Obj>
<Details plainTxt="False" ><![CDATA[<table><tr><td><span style="text-align : left; font-size : 12px; ">Local Browser</span></td></tr></table>]]></Details>
<Time><![CDATA[8/30/2018 - 14:00:17]]></Time>
<TimeTick>1535630417</TimeTick>
<Step rID="T8">
<Obj plainTxt="False" ><![CDATA[Online Shopping Site for]]></Obj>
<Details plainTxt="False" ><![CDATA[Page]]></Details>
<Time><![CDATA[8/30/2018 - 14:00:17]]></Time>
<TimeTick>1535630417</TimeTick>
<Step rID="T9">
<Obj plainTxt="False" ><![CDATA[Online Shopping Site for.Sync]]></Obj>
<Details plainTxt="False" ><![CDATA[]]></Details>
<Time><![CDATA[8/30/2018 - 14:00:17]]></Time>
<TimeTick>1535630417</TimeTick>
<NodeArgs eType="Replay" icon="7" nRep="16" Source="Action1" SourceLine="5" >
<Disp><![CDATA[Online Shopping Site for.Sync]]></Disp>
</NodeArgs>
</Step>
<Step rID="T10">
<Obj plainTxt="False" ><![CDATA[q.Set]]></Obj>
<Details plainTxt="False" ><![CDATA["red mi note 5 pro cover"]]></Details>
<Time><![CDATA[8/30/2018 - 14:00:18]]></Time>
<TimeTick>1535630418</TimeTick>
<NodeArgs eType="Replay" icon="8" nRep="19" Source="Action1" SourceLine="7" >
<Disp><![CDATA[q.Set]]></Disp>
</NodeArgs>
</Step>
<NodeArgs eType="Context" icon="7" nRep="15" Source="Action1" SourceLine="5" >
<Disp><![CDATA[Online Shopping Site for]]></Disp>
</NodeArgs>
</Step>
<Step rID="T11">
<Obj plainTxt="False" ><![CDATA[Online Shopping Site for_2]]></Obj>
<Details plainTxt="False" ><![CDATA[Page]]></Details>
<Time><![CDATA[8/30/2018 - 14:00:18]]></Time>
<TimeTick>1535630418</TimeTick>
<Step rID="T12">
<Obj plainTxt="False" ><![CDATA[WebButton.Click]]></Obj>
<Details plainTxt="False" ><![CDATA[]]></Details>
<Time><![CDATA[8/30/2018 - 14:00:18]]></Time>
<TimeTick>1535630418</TimeTick>
<NodeArgs eType="Replay" icon="9" nRep="23" Source="Action1" SourceLine="8" >
<Disp><![CDATA[WebButton.Click]]></Disp>
</NodeArgs>
</Step>
<Step rID="T13">
<Obj plainTxt="False" ><![CDATA[Online Shopping Site for_2.Sync]]></Obj>
<Details plainTxt="False" ><![CDATA[]]></Details>
<Time><![CDATA[8/30/2018 - 14:00:23]]></Time>
<TimeTick>1535630423</TimeTick>
<NodeArgs eType="Replay" icon="7" nRep="26" Source="Action1" SourceLine="11" >
<Disp><![CDATA[Online Shopping Site for_2.Sync]]></Disp>
</NodeArgs>
</Step>
<Step rID="T14">
<Obj plainTxt="False" ><![CDATA[Flipkart SmartBuy Back.Click]]></Obj>
<Details plainTxt="False" ><![CDATA[]]></Details>
<Time><![CDATA[8/30/2018 - 14:00:24]]></Time>
<TimeTick>1535630424</TimeTick>
<NodeArgs eType="Replay" icon="10" nRep="29" Source="Action1" SourceLine="12" >
<Disp><![CDATA[Flipkart SmartBuy Back.Click]]></Disp>
</NodeArgs>
</Step>
<NodeArgs eType="Context" icon="7" nRep="22" Source="Action1" SourceLine="8" >
<Disp><![CDATA[Online Shopping Site for_2]]></Disp>
</NodeArgs>
</Step>
<NodeArgs eType="Context" icon="6" nRep="14" Source="Action1" SourceLine="5" >
<Disp><![CDATA[Browser]]></Disp>
</NodeArgs>
</Step>
<Step rID="T15">
<Obj plainTxt="False" ><![CDATA[Flipkart SmartBuy Back]]></Obj>
<Details plainTxt="False" ><![CDATA[<table><tr><td><span style="text-align : left; font-size : 12px; ">Local Browser</span></td></tr></table>]]></Details>
<Time><![CDATA[8/30/2018 - 14:00:28]]></Time>
<TimeTick>1535630428</TimeTick>
<Step rID="T16">
<Obj plainTxt="False" ><![CDATA[Flipkart SmartBuy Back]]></Obj>
<Details plainTxt="False" ><![CDATA[Page]]></Details>
<Time><![CDATA[8/30/2018 - 14:00:28]]></Time>
<TimeTick>1535630428</TimeTick>
<Step rID="T17">
<Obj plainTxt="False" ><![CDATA[Flipkart SmartBuy Back.Sync]]></Obj>
<Details plainTxt="False" ><![CDATA[]]></Details>
<Time><![CDATA[8/30/2018 - 14:00:28]]></Time>
<TimeTick>1535630428</TimeTick>
<NodeArgs eType="Replay" icon="7" nRep="34" Source="Action1" SourceLine="13" >
<Disp><![CDATA[Flipkart SmartBuy Back.Sync]]></Disp>
</NodeArgs>
</Step>
<Step rID="T18">
<Obj plainTxt="False" ><![CDATA[ADD TO CART.Fire Web Event]]></Obj>
<Details plainTxt="False" ><![CDATA["onmouseover"]]></Details>
<Time><![CDATA[8/30/2018 - 14:00:28]]></Time>
<TimeTick>1535630428</TimeTick>
<NodeArgs eType="Replay" icon="9" nRep="37" Source="Action1" SourceLine="16" >
<Disp><![CDATA[ADD TO CART.Fire Web Event]]></Disp>
</NodeArgs>
</Step>
<Step rID="T19">
<Obj plainTxt="False" ><![CDATA[ADD TO CART.Click]]></Obj>
<Details plainTxt="False" ><![CDATA[]]></Details>
<Time><![CDATA[8/30/2018 - 14:00:29]]></Time>
<TimeTick>1535630429</TimeTick>
<NodeArgs eType="Replay" icon="9" nRep="40" Source="Action1" SourceLine="18" >
<Disp><![CDATA[ADD TO CART.Click]]></Disp>
</NodeArgs>
</Step>
<NodeArgs eType="Context" icon="7" nRep="33" Source="Action1" SourceLine="13" >
<Disp><![CDATA[Flipkart SmartBuy Back]]></Disp>
</NodeArgs>
</Step>
<Step rID="T20">
<Obj plainTxt="False" ><![CDATA[Shopping Cart | Flipkart.com]]></Obj>
<Details plainTxt="False" ><![CDATA[Page]]></Details>
<Time><![CDATA[8/30/2018 - 14:00:29]]></Time>
<TimeTick>1535630429</TimeTick>
<Step rID="T21">
<Obj plainTxt="False" ><![CDATA[Shopping Cart | Flipkart.com.Sync]]></Obj>
<Details plainTxt="False" ><![CDATA[]]></Details>
<Time><![CDATA[8/30/2018 - 14:00:29]]></Time>
<TimeTick>1535630429</TimeTick>
<NodeArgs eType="Replay" icon="7" nRep="44" Source="Action1" SourceLine="20" >
<Disp><![CDATA[Shopping Cart | Flipkart.com.Sync]]></Disp>
</NodeArgs>
</Step>
<Step rID="T22">
<Obj plainTxt="False" ><![CDATA[Continue shopping.Click]]></Obj>
<Details plainTxt="False" ><![CDATA[]]></Details>
<Time><![CDATA[8/30/2018 - 14:00:30]]></Time>
<TimeTick>1535630430</TimeTick>
<NodeArgs eType="Replay" icon="9" nRep="49" Source="Action1" SourceLine="21" >
<Disp><![CDATA[Continue shopping.Click]]></Disp>
</NodeArgs>
</Step>
<NodeArgs eType="Context" icon="7" nRep="43" Source="Action1" SourceLine="20" >
<Disp><![CDATA[Shopping Cart | Flipkart.com]]></Disp>
</NodeArgs>
</Step>
<Step rID="T23">
<Obj plainTxt="False" ><![CDATA[Online Shopping India]]></Obj>
<Details plainTxt="False" ><![CDATA[Page]]></Details>
<Time><![CDATA[8/30/2018 - 14:00:31]]></Time>
<TimeTick>1535630431</TimeTick>
<Step rID="T24">
<Obj plainTxt="False" ><![CDATA[Online Shopping India.Sync]]></Obj>
<Details plainTxt="False" ><![CDATA[]]></Details>
<Time><![CDATA[8/30/2018 - 14:00:31]]></Time>
<TimeTick>1535630431</TimeTick>
<NodeArgs eType="Replay" icon="7" nRep="53" Source="Action1" SourceLine="22" >
<Disp><![CDATA[Online Shopping India.Sync]]></Disp>
</NodeArgs>
</Step>
<Step rID="T25">
<Obj plainTxt="False" ><![CDATA[Cart.Click]]></Obj>
<Details plainTxt="False" ><![CDATA[]]></Details>
<Time><![CDATA[8/30/2018 - 14:00:31]]></Time>
<TimeTick>1535630431</TimeTick>
<NodeArgs eType="Replay" icon="11" nRep="56" Source="Action1" SourceLine="24" >
<Disp><![CDATA[Cart.Click]]></Disp>
</NodeArgs>
</Step>
<Step rID="T26">
<Obj plainTxt="False" ><![CDATA[Online Shopping India.Sync]]></Obj>
<Details plainTxt="False" ><![CDATA[]]></Details>
<Time><![CDATA[8/30/2018 - 14:00:31]]></Time>
<TimeTick>1535630431</TimeTick>
<NodeArgs eType="Replay" icon="7" nRep="59" Source="Action1" SourceLine="25" >
<Disp><![CDATA[Online Shopping India.Sync]]></Disp>
</NodeArgs>
</Step>
<NodeArgs eType="Context" icon="7" nRep="52" Source="Action1" SourceLine="22" >
<Disp><![CDATA[Online Shopping India]]></Disp>
</NodeArgs>
</Step>
<Step rID="T27">
<Obj plainTxt="False" ><![CDATA[Shopping Cart | Flipkart.com]]></Obj>
<Details plainTxt="False" ><![CDATA[Page]]></Details>
<Time><![CDATA[8/30/2018 - 14:00:32]]></Time>
<TimeTick>1535630432</TimeTick>
<Step rID="T28">
<Obj plainTxt="False" ><![CDATA[flipkart-smartbuy-rn5-pro-kick.Exist]]></Obj>
<Details plainTxt="False" ><![CDATA["Object exists"]]></Details>
<Time><![CDATA[8/30/2018 - 14:00:32]]></Time>
<TimeTick>1535630432</TimeTick>
<NodeArgs eType="Replay" icon="10" nRep="62" Source="Action1" SourceLine="26" >
<Disp><![CDATA[flipkart-smartbuy-rn5-pro-kick.Exist]]></Disp>
</NodeArgs>
</Step>
<NodeArgs eType="Context" icon="7" nRep="61" Source="Action1" SourceLine="26" >
<Disp><![CDATA[Shopping Cart | Flipkart.com]]></Disp>
</NodeArgs>
</Step>
<NodeArgs eType="Context" icon="6" nRep="32" Source="Action1" SourceLine="13" >
<Disp><![CDATA[Flipkart SmartBuy Back]]></Disp>
</NodeArgs>
</Step>
<Step rID="T29">
<Obj ><![CDATA[Validate whether Item is added to the cart]]></Obj>
<Details ><![CDATA[Item added to the cart successfully]]></Details>
<Time><![CDATA[8/30/2018 - 14:00:32]]></Time>
<TimeTick>1535630432</TimeTick>
<NodeArgs eType="User" icon="12" nRep="63" status="Passed" Source="Action1" SourceLine="29" >
<Disp><![CDATA[Validate whether Item is added to the cart]]></Disp>
</NodeArgs>
</Step>
<Step rID="T30">
<Obj plainTxt="False" ><![CDATA[Flipkart SmartBuy Back]]></Obj>
<Details plainTxt="False" ><![CDATA[<table><tr><td><span style="text-align : left; font-size : 12px; ">Local Browser</span></td></tr></table>]]></Details>
<Time><![CDATA[8/30/2018 - 14:00:32]]></Time>
<TimeTick>1535630432</TimeTick>
<Step rID="T31">
<Obj plainTxt="False" ><![CDATA[Shopping Cart | Flipkart.com]]></Obj>
<Details plainTxt="False" ><![CDATA[Page]]></Details>
<Time><![CDATA[8/30/2018 - 14:00:32]]></Time>
<TimeTick>1535630432</TimeTick>
<Step rID="T32">
<Obj plainTxt="False" ><![CDATA[Remove.Click]]></Obj>
<Details plainTxt="False" ><![CDATA[]]></Details>
<Time><![CDATA[8/30/2018 - 14:00:32]]></Time>
<TimeTick>1535630432</TimeTick>
<NodeArgs eType="Replay" icon="11" nRep="68" Source="Action1" SourceLine="30" >
<Disp><![CDATA[Remove.Click]]></Disp>
</NodeArgs>
</Step>
<Step rID="T33">
<Obj plainTxt="False" ><![CDATA[[ Online Shopping Site for Mobiles, Fashion, Books, Electronics, Home Appliances and More ].Close All Tabs]]></Obj>
<Details plainTxt="False" ><![CDATA[]]></Details>
<Time><![CDATA[8/30/2018 - 14:00:32]]></Time>
<TimeTick>1535630432</TimeTick>
<NodeArgs eType="Replay" icon="6" nRep="69" Source="Action1" SourceLine="38" >
<Disp><![CDATA[[ Online Shopping Site for Mobiles, Fashion, Books, Electronics, Home Appliances and More ].Close All Tabs]]></Disp>
</NodeArgs>
</Step>
<NodeArgs eType="Context" icon="7" nRep="67" Source="Action1" SourceLine="30" >
<Disp><![CDATA[Shopping Cart | Flipkart.com]]></Disp>
</NodeArgs>
</Step>
<NodeArgs eType="Context" icon="6" nRep="66" Source="Action1" SourceLine="30" >
<Disp><![CDATA[Flipkart SmartBuy Back]]></Disp>
</NodeArgs>
</Step>
<Summary sTime="8/30/2018 - 14:00:05" eTime="8/30/2018 - 14:00:33" passed="2" failed="0" warnings="0" ></Summary>
<NodeArgs eType="StartAction" icon="4" nRep="7" status="Passed" >
<Disp><![CDATA[Action1 Summary]]></Disp>
</NodeArgs>
</Action>
<NodeArgs eType="StartIteration" icon="3" nRep="6" status="Passed" >
<Disp><![CDATA[GUITest1 Iteration 1 (Row 1)]]></Disp>
</NodeArgs>
</DIter>
<Summary sTime="8/30/2018 - 14:00:03" eTime="8/30/2018 - 14:00:33" passed="2" failed="0" warnings="0" ></Summary>
<NodeArgs eType="StartTest" icon="1" nRep="3" status="Passed" >
<Disp><![CDATA[Test GUITest1 Summary]]></Disp>
</NodeArgs>
</Doc>
</Report>